8. collectPeopleInjuredInfo()* ,CR-193,10351,Subtask,To Do,CR,Changes,software,Esther,5f76d891e31b69006f9b1873,,Medium,,Esther,5f76d891e31b69006f9b1873,Esther,5f76d891e31b69006f9b1873,Esther,5f76d891e31b69006f9b1873,10/Jun/21 11:00 AM,29/Nov/23 4:46 PM,,,,0,,,,,,,Esther,,,,,,5f76d891e31b69006f9b1873,,,,,,,,,,,,,,,,,,,,,,,,,,,,,,,,,,,,,,,,,,,,,,,,,,,,,,,,,,,,,,,,,,,,,,,,,,,,,,,,,,,,,,,,,,,,,,,,,,,,,,,,,,,,,,,,,,,,,,,,,,,,,,,,,,,,,,,,,,,,,,,,,,,,,,,,,,,,,,,,,,,,,,,,,,,,,,,,,,,,,,,,,,,,,,,,,,,,,,,,,,,,,,,,,,,,,,,,,,,,,,,,,,,,,,,,,,,,,,,,,,,,,,,,,{},,,,0|i001vb:,Feb 2022 Sprint,April 2022 SPrint,,,,,,,29/Nov/23 4:45 PM;5f76d891e31b69006f9b1873;[~accountid:5f881013c07c880075ad4580] this is missing from accident form but is there in Accident & Assessment Onsite Form,,,,,,,,,,,,,,,,,,,,,,,,,,,,,,,,,,,,,,,,,,,,,,,,,,,,,,,,,,,,,,,,,,,,,,,,,,,10204,CR-92,Assessment Report,In Progress,29/Nov/23 4:45 PM
"On Accident and Assessment, onSite should read Accident form and offSite should read Assessment form on Mobile app",SR-1045,11330,Task,Backlog,SR,Support,software,Esther,5f76d891e31b69006f9b1873,,Medium,,,,Esther,5f76d891e31b69006f9b1873,Esther,5f76d891e31b69006f9b1873,29/Nov/23 4:28 PM,29/Nov/23 4:28 PM,,,,0,,,,,,,Esther,,,,,,5f76d891e31b69006f9b1873,,,,,,,,,,,,,,,,,,,,,,,,,,,,,,,,,,,,,,,,,,,,,,,,,,,,,,,,,,,,,,,,,,,,,,,,,,,,,,,,,,,,,,,,,,,,,,,,,,,,,,,,,,,,,,,,,,,,,,,,,,,,,,,,,,,,,,,,,,,,,,,,,,,,,,,,,,,,,,,,,,,,,,,,,,,,,,,,,,,,,,,,,,,,,,,,,,,,,,,,,,,,,,,,,,,,,,,,,,,,,,,,,,,,,,,,,,,,,,,,,,,,,,,,,{},,,,0|i007f1:,,,,,,,,,,,,,,,,,,,,,,,,,,,,,,,,,,,,,,,,,,,,,,,,,,,,,,,,,,,,,,,,,,,,,,,,,,,,,,,,,,,,,,,To Do,29/Nov/23 4:28 PM
9. collectWitnessInfo()* ,CR-194,10352,Subtask,To Do,CR,Changes,software,Esther,5f76d891e31b69006f9b1873,,Medium,,Esther,5f76d891e31b69006f9b1873,Esther,5f76d891e31b69006f9b1873,Esther,5f76d891e31b69006f9b1873,10/Jun/21 11:00 AM,29/Nov/23 4:25 PM,,,,0,,,,,Collect witness information and recording,,Esther,,,,,,5f76d891e31b69006f9b1873,,,,,,,,,,,,,,,,,,,,,,,,,,,,,,,,,,,,,,,,,,,,,,,,,,,,,,,,,,,,,,,,,,,,,,,,,,,,,,,,,,,,,,,,,,,,,,,,,,,,,,,,,,,,,,,,,,,,,,,,,,,,,,,,,,,,,,,,,,,,,,,,,,,,,,,,,,,,,,,,,,,,,,,,,,,,,,,,,,,,,,,,,,,,,,,,,,,,,,,,,,,,,,,,,,,,,,,,,,,,,,,,,,,,,,,,,,,,,,,,,,,,,,,,,{},,,,0|i001vj:,Feb 2022 Sprint,April 2022 SPrint,,,,,,,"29/Nov/23 4:25 PM;5f76d891e31b69006f9b1873;[~accountid:5f881013c07c880075ad4580] this has been implemented for assessment, should be moved to accident report",,,,,,,,,,,,,,,,,,,,,,,,,,,,,,,,,,,,,,,,,,,,,,,,,,,,,,,,,,,,,,,,,,,,,,,,,,,10204,CR-92,Assessment Report,In Progress,29/Nov/23 4:24 PM
3. collectDriverStatement()* ,CR-191,10349,Subtask,To Do,CR,Changes,software,Esther,5f76d891e31b69006f9b1873,,Medium,,Esther,5f76d891e31b69006f9b1873,Esther,5f76d891e31b69006f9b1873,Esther,5f76d891e31b69006f9b1873,10/Jun/21 11:00 AM,29/Nov/23 4:23 PM,,,,0,,,,,"*Record audio statement* button, required for onsite, but optional for offsite.



For offsite:

Add button 

“Request driver’s statement”

OnClick, system send’s from [statement@solvit.co.ke|mailto:statement@solvit.co.ke] with a link to an *offsite_driver_witness_form* with pre-populated questions (to be shared) and an option to attach up to 5 images. 

Driver is prompted to respond within 24hours,... the office team can follow based on statement status. 

For this kind of statement, we add a disclaimer on the report that the driver statement and images have been provided by the driver and we did not witness the accident scene",,Esther,,,,,,5f76d891e31b69006f9b1873,,,,,,,,,,,,,,,,,,,,,,,,,,,,,,,,,,,,,,,,,,,,,,,,,,,,,,,,,,,,,,,,,,,,,,,,,,,,,,,,,,,,,,,,,,,,,,,,,,,,,,,,,,,,,,,,,,,,,,,,,,,,,,,,,,,,,,,,,,,,,,,,,,,,,,,,,,,,,,,,,,,,,,,,,,,,,,,,,,,,,,,,,,,,,,,,,,,,,,,,,,,,,,,,,,,,,,,,,,,,,,,,,,,,,,,,,,,,,,,,,,,,,,,,,{},,,,0|i001u0:,Feb 2022 Sprint,April 2022 SPrint,,,,,,,29/Nov/23 4:23 PM;5f76d891e31b69006f9b1873;[~accountid:5f881013c07c880075ad4580] looks like this is not implemented for offsite. ,,,,,,,,,,,,,,,,,,,,,,,,,,,,,,,,,,,,,,,,,,,,,,,,,,,,,,,,,,,,,,,,,,,,,,,,,,,10204,CR-92,Assessment Report,In Progress,29/Nov/23 4:23 PM
Hold on this request - Upload image for 157382,SR-1039,11324,Task,Backlog,SR,Support,software,Esther,5f76d891e31b69006f9b1873,,Medium,,Esther,5f76d891e31b69006f9b1873,Esther,5f76d891e31b69006f9b1873,Esther,5f76d891e31b69006f9b1873,29/Nov/23 1:13 PM,29/Nov/23 1:14 PM,,,,0,,,,,"!Image.jpg|thumbnail!

",,Esther,,,,,,5f76d891e31b69006f9b1873,,,,,,;29/Nov/23 1:14 PM;ug:52900c16-89cf-413b-8fb8-93c609755023;14400,,,,,,,,,,,,,,,,,,,,,,,,,,,,,,,,,,,,,,,,,,,,,,,,,,,,,,,,,,,,,,,,,,,,,,,,,,,,,,,,,,,,,,,,,,,,,,,,,,,,,,,,,,,,,,,,,,,,,,,,,,,,,,,,,,,,,,,,,,,,,,,,,,,,,,,,,,,,,,,,,,,,,,,,,,,,,,,,,,,,,,,,,,,,,,,,,,,,,,,,,,,,,,,,,,,,,,,,0,0,14400,,0,0,14400,,,,,,,,,,,29/Nov/23 1:13 PM;ug:52900c16-89cf-413b-8fb8-93c609755023;Image.jpg;https://solvit-app.atlassian.net/rest/api/3/attachment/content/11206,,,,,,,,,,{},,,,0|i007dx:,,,,,,,,,,,,,,,,,,,,,,,,,,,,,,,,,,,,,,,,,,,,,,,,,,,,,,,,,,,,,,,,,,,,,,,,,,,,,,,,,,,,,,,To Do,29/Nov/23 1:14 PM
Swagger API clarification,SR-1032,11317,Task,Backlog,SR,Support,software,Esther,5f76d891e31b69006f9b1873,,Medium,,Esther,5f76d891e31b69006f9b1873,Esther,5f76d891e31b69006f9b1873,Esther,5f76d891e31b69006f9b1873,24/Nov/23 9:41 AM,24/Nov/23 11:13 AM,,,,0,,,,,"# On /api/request/insurance-initiate-request, response is 
## {
  ""requestId"": 499,
  ""message"": ""You have successfully initiated request.""
}
### Is requestId the same as request_id as in DB, or is this the initiate_request_id?
# /api/request/detail, the description reads' “Request detail by id”. This is confusing, since this is the initiate request ID. Change to read “Request detail by initiate id”
# /api/request/schedule-initiate-request
## Is this scheduling an existing valuation, or does this initiate and schedule?
# /api/request/initiate-request-list
## Expected a list, but this takes one vehicle by registration. Is there an endpoint that returns a list of “initiated_request_master” and “request_master”,..?
# /api/request/valuation-request-list, /api/request/valuation-detail-list and, the ID field, is it the request_id or initiate_request_id?",,Esther,,,,,,5f76d891e31b69006f9b1873,,,,,,,,,,,,,,,,,,,,,,,,,,,,,,,,,,,,,,,,,,,,,,,,,,,,,,,,,,,,,,,,,,,,,,,,,,,,,,,,,,,,,,,,,,,,,,,,,,,,,,,,,,,,,,,,,,,,,,,,,,,,,,,,,,,,,,,,,,,,,,,,,,,,,,,,,,,,,,,,,,,,,,,,,,,,,,,,,,,,,,,,,,,,,,,,,,,,,,,,,,,,,,,,,,,,,,,,,,,,,,,,,,,,,,,,,,,,,,,,,,,,,,,,,{},,,,0|i007cd:,,,,,,,,,,,,,,,,,,,,,,,,,,,,,,,,,,,,,,,,,,,,,,,,,,,,,,,,,,,,,,,,,,,,,,,,,,,,,,,,,,,,,,,To Do,24/Nov/23 9:41 AM
"Corel Solver ^ I have realized that anytime I pause a job it submits automatically, kindly check on this",SR-1006,11291,Bug,Backlog,SR,Support,software,Esther,5f76d891e31b69006f9b1873,,Medium,,Esther,5f76d891e31b69006f9b1873,Esther,5f76d891e31b69006f9b1873,Esther,5f76d891e31b69006f9b1873,04/Nov/23 1:41 PM,13/Nov/23 12:33 PM,,,06/Nov/23 12:00 AM,0,,,,,,,Esther,,,,,,5f76d891e31b69006f9b1873,,,,,,,,,,,,,,,,,,,,,,,,,,,,,,,,,,,,,,,,,,,,,,,,,,,,,,,,,,,,,,,,,,,,,,,,,,,,,,,,,,,,,,,,,,,,,,,,,,,,,,,,,,,,,,,,,,,,,,,,,,,,,,,,,,,,,,,,,,,,,,,,,,,,,,,,,,,,,,,,,,,,,,,,,,,,,,,,,,,,,,,,,,,,,,,,,,,,,,,,,,,,,,,,,,,,,,,,,,,,,,,,,,,,,,,,,,,,,,,,,,,,,,,,,{},,,,0|i0076l:,,,,,,,,,,,,,,,,,,,,,,,,,,,,,,,,,,,,,,,,,,,,,,,,,,,,,,,,,,,,,,,,,,,,,,,,,,,,,,,,,,,,,,,To Do,13/Nov/23 12:33 PM
What are the pros and cons of having duplicated initiated requests on the dashboard? ,SR-978,11263,Task,Backlog,SR,Support,software,Esther,5f76d891e31b69006f9b1873,,Medium,,Mansi Patel,557058:666737e2-1a8a-453f-9a14-72a95f4f92cb,Wekesa48,636a09b6c87c504330089509,Wekesa48,636a09b6c87c504330089509,27/Oct/23 2:56 PM,31/Oct/23 11:03 AM,,,27/Oct/23 12:00 AM,0,,,,,"We have cases where we a solver have already initiated requests and the team also initiates and then we have two cases. 

As shown in the image below;

!thumbnail_image.png|width=1025,height=576!",,Esther,Mansi Patel,Wekesa48,,,,5f76d891e31b69006f9b1873,557058:666737e2-1a8a-453f-9a14-72a95f4f92cb,636a09b6c87c504330089509,,,,,,,,,,,,,,,,,,,,,,,,,,,,,,,,,,,,,,,,,,,,,,,,,,,,,,,,,,,,,,,,,,,,,,,,,,,,,,,,,,,,,,,,,,,,,,,,,,,,,,,,,,,,,,,,,,,,,,,,,,,,,,,,,,,,,,,,,,,,,,,,,,,,,,,,,,,,,,,,,,,,,,,,,,,,,,,,,,,,,,,,,,,,,,,,,,,,,,,,,,,,,,,,,,,,,,,,,,,,,,,,,,,,,,,,,,,,,27/Oct/23 2:58 PM;rk:55df315a-0a50-4a5a-bd06-0b1a7bbe3707;thumbnail_image.png;https://solvit-app.atlassian.net/rest/api/3/attachment/content/11057,,,,,,,,,,{},,,,0|i0070d:,,,,,,,,,27/Oct/23 2:59 PM;636a09b6c87c504330089509;[~accountid:557058:666737e2-1a8a-453f-9a14-72a95f4f92cb] Check on this. ,"27/Oct/23 3:03 PM;557058:666737e2-1a8a-453f-9a14-72a95f4f92cb;[~accountid:636a09b6c87c504330089509] Can you please share more information, what exactly do we need to check on this?",31/Oct/23 11:03 AM;5f76d891e31b69006f9b1873;[~accountid:636a09b6c87c504330089509] What is the problem you are trying to solve here?,,,,,,,,,,,,,,,,,,,,,,,,,,,,,,,,,,,,,,,,,,,,,,,,,,,,,,,,,,,,,,,,,,,,,,,,,,,,To Do,31/Oct/23 11:03 AM
Update KRA CRSP data,CR-120,10234,Subtask,backlog,CR,Changes,software,Esther,5f76d891e31b69006f9b1873,,Medium,,Njoroge Kibutu,5f967b71b38e610071f11769,Esther,5f76d891e31b69006f9b1873,Esther,5f76d891e31b69006f9b1873,16/Mar/21 3:46 PM,25/Oct/23 3:55 PM,,,24/Mar/21 12:00 AM,0,,,,,The KRA CRSP database is updated annually. Kindly prepare and share the 2021 DB for accurate valuation logic calculation.,,Esther,,,,,,5f76d891e31b69006f9b1873,,,,,,,,,,,,,,,,,,,,,,,,,,,,,,,,,,,,,,,,,,,,,,,,,,,,,,,,,,,,,,,,,,,,,,,,,,,,,,,,,,,,,,,,,,,,,,,,,,,,,,,,,,,,,,,,,,,,,,,,,,,,,,,,,,,,,,,,,,,,,,,,,,,,,,,,,,,,,,,,,,,,,,,,,,,,,,,,,,,,,,,,,,,,,,,,,,,,,,,,,,,,,,,,,,,,,,,,,,,,,,,,,,,,,,,,,,,,,,,,,,,,,,,,,{},,,,0|i0018b:,,,,,,,,,"18/Aug/21 10:35 AM;5f76d891e31b69006f9b1873;Update: Ditched this for manually entering Local Dealership Value, so will mark this as resolved.",,,,,,,,,,,,,,,,,,,,,,,,,,,,,,,,,,,,,,,,,,,,,,,,,,,,,,,,,,,,,,,,,,,,,,,,,,,10225,CR-111,Valuation form edits,To Do,19/Dec/22 2:35 PM
"When a solver tries to initiate, they get the error, ""save and retry"" example KCX806A ^ Caroline",SR-975,11260,Story,Backlog,SR,Support,software,Esther,5f76d891e31b69006f9b1873,,Medium,,,,Esther,5f76d891e31b69006f9b1873,Esther,5f76d891e31b69006f9b1873,25/Oct/23 3:44 PM,25/Oct/23 3:45 PM,,,,0,,,,,,,,,,,,,,,,,,,,,,,,,,,,,,,,,,,,,,,,,,,,,,,,,,,,,,,,,,,,,,,,,,,,,,,,,,,,,,,,,,,,,,,,,,,,,,,,,,,,,,,,,,,,,,,,,,,,,,,,,,,,,,,,,,,,,,,,,,,,,,,,,,,,,,,,,,,,,,,,,,,,,,,,,,,,,,,,,,,,,,,,,,,,,,,,,,,,,,,,,,,,,,,,,,,,,,,,,,,,,,,,,,,,,,,,,,,,,,,,,,,,,,,,,,,,,,,,,,,,,,{},,,,0|i006zp:,,,,,,,,,,,,,,,,,,,,,,,,,,,,,,,,,,,,,,,,,,,,,,,,,,,,,,,,,,,,,,,,,,,,,,,,,,,,,,,,,,,,,,,To Do,25/Oct/23 3:44 PM
Analytics,SR-514,10779,Task,Backlog,SR,Support,software,Esther,5f76d891e31b69006f9b1873,,Medium,,Esther,5f76d891e31b69006f9b1873,Esther,5f76d891e31b69006f9b1873,Esther,5f76d891e31b69006f9b1873,17/Oct/22 4:34 PM,24/Oct/23 4:33 PM,,,17/Oct/22 12:00 AM,0,,,,,"Created the following charts

* Approvals, by valuation month
* Approvals, by valuation month by channel partners",,Esther,,,,,,5f76d891e31b69006f9b1873,,,,,,,,,,,,,,,,,,,,,,,,,,,,,,,,,,,,,,,,,,,,,,,,,,,,,,,,,,,,,,,,,,,,,,,,,,,,,,,,,,,,,,,,,,,,,,,,,,,,,,,,,,,,,,,,,,,,,,,,,,,,,,,,,,,,,,,,,,,,,,,,,,,,,,,,,,,,,,,,,,,,,,,,,,,,,,,,,,,,,,,,,,,,,,,,,,,,,,,,,,,,,,,,,,,,,,,,,,,,,,,,,,,,,,,,,,,,,,,,,,,,,,,,,{},,,,0|i002s3:,,,,,,,,,,,,,,,,,,,,,,,,,,,,,,,,,,,,,,,,,,,,,,,,,,,,,,,,,,,,,,,,,,,,,,,,,,,,,,,,,,,,,,,To Do,24/Oct/23 4:33 PM
Solvit pause functionality flow,SR-512,10777,Task,Backlog,SR,Support,software,Esther,5f76d891e31b69006f9b1873,,Medium,,Esther,5f76d891e31b69006f9b1873,Esther,5f76d891e31b69006f9b1873,Esther,5f76d891e31b69006f9b1873,17/Oct/22 3:22 PM,24/Oct/23 8:54 AM,,,,0,,,,,,,Esther,,,,,,5f76d891e31b69006f9b1873,,,,,,;17/Oct/22 3:31 PM;ug:52900c16-89cf-413b-8fb8-93c609755023;5400,"* Confirmed that clearing cache does not affect paused jobs that have been successfully submitted to the server. 
* Also confirmed that, clicking Continue does not affect pause status if solver does nothing
* Found that images fail to load when the connection is interrupted, meaning, the job does not pause successfully. 
* Solution  add validation for this eg, if the user has taken 8 photos, issue success message when 8 images have been uploaded, else share error message specifying which image has not loaded;18/Oct/22 5:10 PM;ug:52900c16-89cf-413b-8fb8-93c609755023;7200",Solvit and Dev Team Pause functionality meeting;24/Nov/22 10:04 AM;ug:52900c16-89cf-413b-8fb8-93c609755023;3600,,,,,,,,,,,,,,,,,,,,,,,,,,,,,,,,,,,,,,,,,,,,,,,,,,,,,,,,,,,,,,,,,,,,,,,,,,,,,,,,,,,,,,,,,,,,,,,,,,,,,,,,,,,,,,,,,,,,,,,,,,,,,,,,,,,,,,,,,,,,,,,,,,,,,,,,,,,,,,,,,,,,,,,,,,,,,,,,,,,,,,,,,,,,,,,,,,,,,,,,,,,,,,,,,,,,,,,0,16200,,,0,16200,,,,,,,,,,,,,,,,,,,,,{},,,,0|i0058v:i,,,,,,,,,,,,,,,,,,,,,,,,,,,,,,,,,,,,,,,,,,,,,,,,,,,,,,,,,,,,,,,,,,,,,,,,,,,,,,,,,,,,,,,To Do,24/Oct/23 8:54 AM
Show/Hide password functionality for the web application during login.,SR-352,10414,Story,Backlog,SR,Support,software,Esther,5f76d891e31b69006f9b1873,,Medium,,Mansi Patel,557058:666737e2-1a8a-453f-9a14-72a95f4f92cb,Esther,5f76d891e31b69006f9b1873,Esther,5f76d891e31b69006f9b1873,06/Aug/21 11:36 AM,24/Oct/23 8:52 AM,,,21/Dec/22 12:00 AM,0,,,,,,,Esther,Mansi Patel,Wekesa48,,,,5f76d891e31b69006f9b1873,557058:666737e2-1a8a-453f-9a14-72a95f4f92cb,636a09b6c87c504330089509,,,,,,,,,,,,,,,,,,,,,,,,,,,,,,,,,,,,,,,,,,,,,,,,,,,,,,,,,,,,,,,,,,,,,,,,,,,,,,,,,,,,,,,,,,,,,,,,,,,,,,,,,,,,,,,,,,,,,,,,,,,,,,,,,,,,,,,,,,,,,,,,,,,,,,,,,,,,,,,,,,,,,,,,,,,,,,,,,,,,,,,,,,,,,,,,,,,,,,,,,,,,,,,,,,,,,,,,,,,,,,,,,,,,,,,,,,,,,,,,,,,,,,,{},,,,0|i002xt:zu,,,,,,,,,"26/Jul/22 8:03 AM;557058:666737e2-1a8a-453f-9a14-72a95f4f92cb;[~accountid:5f76d891e31b69006f9b1873] Can you please let us know in which screen, which app we need to implement this?","26/Jul/22 8:06 AM;5f76d891e31b69006f9b1873;[~accountid:557058:666737e2-1a8a-453f-9a14-72a95f4f92cb] this is in Backlog, can discuss when it becomes a to-do ","14/Dec/22 1:41 PM;636a09b6c87c504330089509;[~accountid:557058:666737e2-1a8a-453f-9a14-72a95f4f92cb] SInce on the mobile app there is a show/hide password functionality during login, could we have the same for the web application? Let me know the deadline so that I can update the SR.  ",,,,,,,,,,,,,,,,,,,,,,,,,,,,,,,,,,,,,,,,,,,,,,,,,,,,,,,,,,,,,,,,,,,,,,,,,,,,To Do,24/Oct/23 8:52 AM
Solver cannot see a job on his schedule,SR-954,11238,Task,Backlog,SR,Support,software,Esther,5f76d891e31b69006f9b1873,,Medium,,Mansi Patel,557058:666737e2-1a8a-453f-9a14-72a95f4f92cb,Wekesa48,636a09b6c87c504330089509,Wekesa48,636a09b6c87c504330089509,09/Oct/23 9:53 AM,23/Oct/23 10:31 AM,,,09/Oct/23 12:00 AM,0,,,,,"Sovler details;

email: [kellyrolance@gmail.com|mailto:kellyrolance@gmail.com]
 Password: 36373514A",,Wekesa48,,,,,,636a09b6c87c504330089509,,,,,,,,,,,,,,,,,,,,,,,,,,,,,,,,,,,,,,,,,,,,,,,,,,,,,,,,,,,,,,,,,,,,,,,,,,,,,,,,,,,,,,,,,,,,,,,,,,,,,,,,,,,,,,,,,,,,,,,,,,,,,,,,,,,,,,,,,,,,,,,,,,,,,,,,,,,,,,,,,,,,,,,,,,,,,,,,,,,,,,,,,,,,,,,,,,,,,,,,,,,,,,,,,,,,,,,,,,,,,,,,,,,,,,,,,,,,,,,,,,,,,,,,,{},,,,0|i006v1:,,,,,,,,,"09/Oct/23 9:54 AM;636a09b6c87c504330089509;[~accountid:557058:a5ff4af3-8ca3-48b2-97b8-555752f6dd3d] Please check on this, what could be the reasons why solvers experience this issue. ",,,,,,,,,,,,,,,,,,,,,,,,,,,,,,,,,,,,,,,,,,,,,,,,,,,,,,,,,,,,,,,,,,,,,,,,,,,,,,To Do,23/Oct/23 10:31 AM
Replace 'Preview' page with 'Verify' page on the solvers App.,SR-929,11213,Task,Backlog,SR,Support,software,Esther,5f76d891e31b69006f9b1873,,Medium,,Wekesa48,636a09b6c87c504330089509,Wekesa48,636a09b6c87c504330089509,Wekesa48,636a09b6c87c504330089509,07/Sep/23 9:03 PM,07/Sep/23 9:43 PM,,,,0,,,,,"I would like to propose an enhancement to the current functionality of the solver's app, specifically concerning the preview page. The request is to replace the existing preview page with a new 'verify' page within the solver's app.

The primary purpose of this 'verify' page is to ensure the completeness of photo uploads to AWS. This feature will help in identifying any photos that have not been successfully uploaded to AWS, allowing solvers to promptly address any missing images by retaking them as needed.

The key objectives for implementing this 'Verify' page are as follows:

# Minimize the occurrence of lost photos by providing a comprehensive overview of uploaded and pending images.
# Enable solvers to easily identify and rectify any missing photos.

The 'Verify' page should be positioned as the final step in the photo-taking process, appearing after the solver has captured all the required images. On this page, solvers should have the ability to:

* Verify which photos have been successfully uploaded to AWS.
* Identify any photos that are yet to be uploaded, with these specific images being clearly highlighted for easy recognition.",,mkiarie,Wekesa48,,,,,5f881013c07c880075ad4580,636a09b6c87c504330089509,,,,,,,,,,,,,,,,,,,,,,,,,,,,,,,,,,,,,,,,,,,,,,,,,,,,,,,,,,,,,,,,,,,,,,,,,,,,,,,,,,,,,,,,,,,,,,,,,,,,,,,,,,,,,,,,,,,,,,,,,,,,,,,,,,,,,,,,,,,,,,,,,,,,,,,,,,,,,,,,,,,,,,,,,,,,,,,,,,,,,,,,,,,,,,,,,,,,,,,,,,,,,,,,,,,,,,,,,,,,,,,,,,,,,,,,,,,,,,,,,,,,,,,,{},,,,0|i006ph:,,,,,,,,,07/Sep/23 9:07 PM;636a09b6c87c504330089509;[~accountid:5f881013c07c880075ad4580] What do you think of this?,07/Sep/23 9:43 PM;5f881013c07c880075ad4580;Isn't this exactly what the preview page does? Let's discuss tomorrow,,,,,,,,,,,,,,,,,,,,,,,,,,,,,,,,,,,,,,,,,,,,,,,,,,,,,,,,,,,,,,,,,,,,,,,,,,,,,To Do,07/Sep/23 9:03 PM
System rejecting request during inititation ,SR-778,11057,Task,Backlog,SR,Support,software,Esther,5f76d891e31b69006f9b1873,,Medium,,Mansi Patel,557058:666737e2-1a8a-453f-9a14-72a95f4f92cb,Wekesa48,636a09b6c87c504330089509,Wekesa48,636a09b6c87c504330089509,19/May/23 3:17 PM,05/Jul/23 12:45 PM,,,22/May/23 12:00 AM,0,,,,,"An example was for this vehicle: KCW 324R

Attached is an image with the error that the system throws after rejecting the request. ",,Mansi Patel,Wekesa48,,,,,557058:666737e2-1a8a-453f-9a14-72a95f4f92cb,636a09b6c87c504330089509,,,,,,,,,,,,,,,,,,,,,,,,,,,,,,,,,,,,,,,,,,,,,,,,,,,,,,,,,,,,,,,,,,,,,,,,,,,,,,,,,,,,,,,,,,,,,,,,,,,,,,,,,,,,,,,,,,,,,,,,,,,,,,,,,,,,,,,,,,,,,,,,,,,,,,,,,,,,,,,,,,,,,,,,,,,,,,,,,,,,,,,,,,,,,,,,,,,,,,,,,,,,,,,,,,,,,,,,,,,,,,,,,,,,,,,,,,,,,,19/May/23 3:16 PM;rk:55df315a-0a50-4a5a-bd06-0b1a7bbe3707;rq.jpg;https://solvit-app.atlassian.net/rest/api/3/attachment/content/10702,,,,,,,,,,{},,,,0|i005r9:,,,,,,,,,"19/May/23 3:45 PM;557058:666737e2-1a8a-453f-9a14-72a95f4f92cb;[~accountid:636a09b6c87c504330089509] It is because with the same vehicle registration id, the request is already there. If the valuation is completed against that registration id then only we are allowing to add the requst.

Hope that clears.",05/Jul/23 12:33 PM;636a09b6c87c504330089509;[~accountid:557058:666737e2-1a8a-453f-9a14-72a95f4f92cb] Is there a way we can sort this out so that we don't have such errors again? ,05/Jul/23 12:44 PM;557058:666737e2-1a8a-453f-9a14-72a95f4f92cb;[~accountid:636a09b6c87c504330089509] We can only initiate requests for those vehicles of which there are no pending request exists.,05/Jul/23 12:45 PM;636a09b6c87c504330089509;[~accountid:557058:666737e2-1a8a-453f-9a14-72a95f4f92cb] Is there a way we can then delete the pending ones so that we reinitiate or a way around it? ,,,,,,,,,,,,,,,,,,,,,,,,,,,,,,,,,,,,,,,,,,,,,,,,,,,,,,,,,,,,,,,,,,,,,,,,,,,To Do,19/May/23 3:17 PM
The default sorting should be by the scheduled valuation date. Add this to the filter too,CR-287,10985,Subtask,To Do,CR,Changes,software,Esther,5f76d891e31b69006f9b1873,,Medium,,Mansi Patel,557058:666737e2-1a8a-453f-9a14-72a95f4f92cb,Esther,5f76d891e31b69006f9b1873,Esther,5f76d891e31b69006f9b1873,25/Apr/23 10:54 AM,25/Apr/23 10:58 AM,,,25/Apr/23 12:00 AM,0,,,,,,,Esther,,,,,,5f76d891e31b69006f9b1873,,,,,,,,,,,,,,,,,,,,,,,,,,,,,,,,,,,,,,,,,,,,,,,,,,,,,,,,,,,,,,,,,,,,,,,,,,,,,,,,,,,,,,,,,,,,,,,,,,,,,,,,,,,,,,,,,,,,,,,,,,,,,,,,,,,,,,,,,,,,,,,,,,,,,,,,,,,,,,,,,,,,,,,,,,,,,,,,,,,,,,,,,,,,,,,,,,,,,,,,,,,,,,,,,,,,,,,,,,,,,,,,,,,,,,,,,,,,,,,,,,,,,,,,,{},,,,0|i005b9:,,,,,,,,,,,,,,,,,,,,,,,,,,,,,,,,,,,,,,,,,,,,,,,,,,,,,,,,,,,,,,,,,,,,,,,,,,,,,,,,,,,,10963,CR-284,Improvements on Solver App's Schedule page to improve performance and UX/UI,In Progress,25/Apr/23 10:58 AM
Tyre make section it's capturing the tyre make twice on the allocated section as well as on the tyre size... It has happened on two different units.,CR-286,10984,Subtask,To Do,CR,Changes,software,Esther,5f76d891e31b69006f9b1873,,Medium,,Mansi Patel,557058:666737e2-1a8a-453f-9a14-72a95f4f92cb,Esther,5f76d891e31b69006f9b1873,Esther,5f76d891e31b69006f9b1873,25/Apr/23 10:53 AM,25/Apr/23 10:55 AM,,,25/Apr/23 12:00 AM,0,,,,,"!Image.jpg|thumbnail!

",,Esther,,,,,,5f76d891e31b69006f9b1873,,,,,,,,,,,,,,,,,,,,,,,,,,,,,,,,,,,,,,,,,,,,,,,,,,,,,,,,,,,,,,,,,,,,,,,,,,,,,,,,,,,,,,,,,,,,,,,,,,,,,,,,,,,,,,,,,,,,,,,,,,,,,,,,,,,,,,,,,,,,,,,,,,,,,,,,,,,,,,,,,,,,,,,,,,,,,,,,,,,,,,,,,,,,,,,,,,,,,,,,,,,,,,,,,,,,,,,,,,,,,,,,,,,,,,,,,,,,,,,25/Apr/23 10:55 AM;ug:52900c16-89cf-413b-8fb8-93c609755023;Image.jpg;https://solvit-app.atlassian.net/rest/api/3/attachment/content/10629,,,,,,,,,,{},,,,0|i005b1:,,,,,,,,,,,,,,,,,,,,,,,,,,,,,,,,,,,,,,,,,,,,,,,,,,,,,,,,,,,,,,,,,,,,,,,,,,,,,,,,,,,,10963,CR-284,Improvements on Solver App's Schedule page to improve performance and UX/UI,In Progress,25/Apr/23 10:54 AM
Upload photos for Request Id 124717,SR-700,10971,Task,Backlog,SR,Support,software,Esther,5f76d891e31b69006f9b1873,,Medium,,Mansi Patel,557058:666737e2-1a8a-453f-9a14-72a95f4f92cb,Wekesa48,636a09b6c87c504330089509,Wekesa48,636a09b6c87c504330089509,12/Apr/23 11:13 AM,12/Apr/23 11:13 AM,,,12/Apr/23 12:00 AM,0,,,,,,,Wekesa48,,,,,,636a09b6c87c504330089509,,,,,,,,,,,,,,,,,,,,,,,,,,,,,,,,,,,,,,,,,,,,,,,,,,,,,,,,,,,,,,,,,,,,,,,,,,,,,,,,,,,,,,,,,,,,,,,,,,,,,,,,,,,,,,,,,,,,,,,,,,,,,,,,,,,,,,,,,,,,,,,,,,,,,,,,,,,,,,,,,,,,,,,,,,,,,,,,,,,,,,,,,,,,,,,,,,,,,,,,,,,,,,,,,,,,,,,,,,,,,,,,,,,,,,,,,,,,,,,12/Apr/23 11:13 AM;rk:55df315a-0a50-4a5a-bd06-0b1a7bbe3707;Request Id 124717.zip;https://solvit-app.atlassian.net/rest/api/3/attachment/content/10618,,,,,,,,,,{},,,,0|i0058t:,,,,,,,,,,,,,,,,,,,,,,,,,,,,,,,,,,,,,,,,,,,,,,,,,,,,,,,,,,,,,,,,,,,,,,,,,,,,,,,,,,,,,,,To Do,12/Apr/23 11:13 AM
