Check why billing table on analytics is skipping or repeating some valuations,SR-1349,11660,Task,Todo,SR,Support,software,Esther,5f76d891e31b69006f9b1873,,Medium,,,,Esther Wango,712020:a9efaeaf-9815-47d8-ad29-d43b8aac9308,Esther Wango,712020:a9efaeaf-9815-47d8-ad29-d43b8aac9308,05/Dec/24 12:24 PM,05/Dec/24 12:24 PM,,,,0,,,,,,,Esther Wango,,,,,,712020:a9efaeaf-9815-47d8-ad29-d43b8aac9308,,,,,,,,,,,,,,,,,,,,,,,,,,,,,,,,,,,,,,,,,,,,,,,,,,,,,,,,,,,,,,,,,,,,,,,,,,,,,,,,,,,,,,,,,,,,,,,,,,,,,,,,,,,,,,,,,,,,,,,,,,,,,,,,,,,,,,,,,,,,,,,,,,,,,,,,,,,,,,,,,,,,,,,,,,,,,,,,,,,,,,,,,,,,,,,,,,,,,,,,,,,,,,,,,,,,,,,,,,,,,,,,,,,,,,,,,,,,,,,,,,,,,,,,,{},,,,0|i009e5:,,,,,,,,,,,,,,,,,,,,,,,,,,,,,,,,,,,,,,,,,,,,,,,,,,,,,,,,,,,,,,,,,,,,,,,,,,,,,,,,,,,,,,,In Progress,05/Dec/24 12:24 PM
"John APA ^ on email received for status updated does not have actionable date, add requested date, requested by, customer name",SR-1280,11586,Task,Backlog,SR,Support,software,Esther,5f76d891e31b69006f9b1873,,Medium,,Esther Wango,712020:a9efaeaf-9815-47d8-ad29-d43b8aac9308,Esther Wango,712020:a9efaeaf-9815-47d8-ad29-d43b8aac9308,Esther Wango,712020:a9efaeaf-9815-47d8-ad29-d43b8aac9308,22/Aug/24 3:52 PM,05/Dec/24 12:20 PM,,,22/Aug/24 12:00 AM,0,,,,,,,Esther Wango,,,,,,712020:a9efaeaf-9815-47d8-ad29-d43b8aac9308,,,,,,,,,,,,,,,,,,,,,,,,,,,,,,,,,,,,,,,,,,,,,,,,,,,,,,,,,,,,,,,,,,,,,,,,,,,,,,,,,,,,,,,,,,,,,,,,,,,,,,,,,,,,,,,,,,,,,,,,,,,,,,,,,,,,,,,,,,,,,,,,,,,,,,,,,,,,,,,,,,,,,,,,,,,,,,,,,,,,,,,,,,,,,,,,,,,,,,,,,,,,,,,,,,,,,,,,,,,,,,,,,,,,,,,,,,,,,,,,,,,,,,,,,{},,,,0|i008z1:,,,,,,,,,,,,,,,,,,,,,,,,,,,,,,,,,,,,,,,,,,,,,,,,,,,,,,,,,,,,,,,,,,,,,,,,,,,,,,,,,,,,,,,To Do,05/Dec/24 12:20 PM
Get Images for KDN363T ^Ruth,SR-1346,11657,Task,Backlog,SR,Support,software,Esther,5f76d891e31b69006f9b1873,,Medium,,Michael Gachuhi,712020:e146dab8-feed-4174-9a6a-cbe8eff9f9a4,Michael Gachuhi,712020:e146dab8-feed-4174-9a6a-cbe8eff9f9a4,Michael Gachuhi,712020:e146dab8-feed-4174-9a6a-cbe8eff9f9a4,05/Dec/24 11:47 AM,05/Dec/24 11:47 AM,,,05/Dec/24 12:00 AM,0,,,,,,,Michael Gachuhi,,,,,,712020:e146dab8-feed-4174-9a6a-cbe8eff9f9a4,,,,,,,,,,,,,,,,,,,,,,,,,,,,,,,,,,,,,,,,,,,,,,,,,,,,,,,,,,,,,,,,,,,,,,,,,,,,,,,,,,,,,,,,,,,,,,,,,,,,,,,,,,,,,,,,,,,,,,,,,,,,,,,,,,,,,,,,,,,,,,,,,,,,,,,,,,,,,,,,,,,,,,,,,,,,,,,,,,,,,,,,,,,,,,,,,,,,,,,,,,,,,,,,,,,,,,,,,,,,,,,,,,,,,,,,,,,,,,,,,,,,,,,,,{},,,,0|i009dh:,,,,,,,,,,,,,,,,,,,,,,,,,,,,,,,,,,,,,,,,,,,,,,,,,,,,,,,,,,,,,,,,,,,,,,,,,,,,,,,,,,,,,,,To Do,05/Dec/24 11:47 AM
Email Templates Proposed Changes. ,SR-1344,11655,Task,Todo,SR,Support,software,Esther,5f76d891e31b69006f9b1873,,Medium,,Michael Gachuhi,712020:e146dab8-feed-4174-9a6a-cbe8eff9f9a4,Michael Gachuhi,712020:e146dab8-feed-4174-9a6a-cbe8eff9f9a4,Michael Gachuhi,712020:e146dab8-feed-4174-9a6a-cbe8eff9f9a4,03/Dec/24 9:14 AM,03/Dec/24 9:14 AM,,,04/Dec/24 12:00 AM,0,,,,,"For the {color:#36b37e}*NOT READY*{color} reason, the email should read 'The valuation request for the registration number KDR989F is pending and has been updated to {color:#36b37e}*NOT READY.*{color} The client has advised that they will call us back when they are ready for valuation.


Let the other reasons also be rectified for example, 

The email for UNREACHABLE should read as follows:

The valuation request for the registration number KTWC012R is pending and has been updated to {color:#36b37e}*UNREACHABLE.*{color} Your prompt assistance in reaching out to the client would greatly help in expediting our service. Thank you for choosing Solvit. 

So let the title of the email match the body, ot as shown below for unreachable.",,Michael Gachuhi,,,,,,712020:e146dab8-feed-4174-9a6a-cbe8eff9f9a4,,,,,,,,,,,,,,,,,,,,,,,,,,,,,,,,,,,,,,,,,,,,,,,,,,,,,,,,,,,,,,,,,,,,,,,,,,,,,,,,,,,,,,,,,,,,,,,,,,,,,,,,,,,,,,,,,,,,,,,,,,,,,,,,,,,,,,,,,,,,,,,,,,,,,,,,,,,,,,,,,,,,,,,,,,,,,,,,,,,,,,,,,,,,,,,,,,,,,,,,,,,,,,,,,,,,,,,,,,,,,,,,,,,,,,,,,,,,,,,,,,,,,,,,,{},,,,0|i009d1:,,,,,,,,,,,,,,,,,,,,,,,,,,,,,,,,,,,,,,,,,,,,,,,,,,,,,,,,,,,,,,,,,,,,,,,,,,,,,,,,,,,,,,,In Progress,03/Dec/24 9:14 AM
"KCT 467D of Request ID 201872 Vehicle above as queried by Old Mutual.  On Zoho, the unit is under Old Mutual and we used these details to Invoice them. But they claim its not their unit.",SR-1332,11643,Task,Backlog,SR,Support,software,Esther,5f76d891e31b69006f9b1873,,Medium,,,,Esther,5f76d891e31b69006f9b1873,Esther,5f76d891e31b69006f9b1873,19/Nov/24 12:18 PM,19/Nov/24 3:24 PM,,,,0,,,,,"It was initiated under Old Mutual on 21 Oct 2024 11:07:54.00 and edited on 21 Oct 2024 11:08:04.000

Then scheduled under APA on 21 Oct 2024 11:07:54.000 and updated on 22 Oct 2024 07:24:50.000 by ",,Esther,,,,,,5f76d891e31b69006f9b1873,,,,,,,,,,,,,,,,,,,,,,,,,,,,,,,,,,,,,,,,,,,,,,,,,,,,,,,,,,,,,,,,,,,,,,,,,,,,,,,,,,,,,,,,,,,,,,,,,,,,,,,,,,,,,,,,,,,,,,,,,,,,,,,,,,,,,,,,,,,,,,,,,,,,,,,,,,,,,,,,,,,,,,,,,,,,,,,,,,,,,,,,,,,,,,,,,,,,,,,,,,,,,,,,,,,,,,,,,,,,,,,,,,,,,,,,,,,,,,,,,,,,,,,,,{},,,,0|i009bp:,,,,,,,,,,,,,,,,,,,,,,,,,,,,,,,,,,,,,,,,,,,,,,,,,,,,,,,,,,,,,,,,,,,,,,,,,,,,,,,,,,,,,,,To Do,19/Nov/24 12:18 PM
Change admin email for STAR DISCOVER INSURANCE COMPANY LIMITED from rbett@starinsurance.co.ke to makama@starinsurance.co.ke and number to 0707495937,SR-1326,11637,Task,Todo,SR,Support,software,Esther,5f76d891e31b69006f9b1873,,Medium,,Mansi Patel,557058:666737e2-1a8a-453f-9a14-72a95f4f92cb,Esther,5f76d891e31b69006f9b1873,Esther,5f76d891e31b69006f9b1873,08/Nov/24 11:22 AM,11/Nov/24 2:34 PM,,,08/Nov/24 12:00 AM,0,,,,,,,Esther,Mansi Patel,,,,,5f76d891e31b69006f9b1873,557058:666737e2-1a8a-453f-9a14-72a95f4f92cb,,,,,,,,,,,,,,,,,,,,,,,,,,,,,,,,,,,,,,,,,,,,,,,,,,,,,,,,,,,,,,,,,,,,,,,,,,,,,,,,,,,,,,,,,,,,,,,,,,,,,,,,,,,,,,,,,,,,,,,,,,,,,,,,,,,,,,,,,,,,,,,,,,,,,,,,,,,,,,,,,,,,,,,,,,,,,,,,,,,,,,,,,,,,,,,,,,,,,,,,,,,,,,,,,,,,,,,,,,,,,,,,,,,,,,,,,,,,,,,,,,,,,,,,{},,,,0|i009ad:,,,,,,,,,11/Nov/24 2:06 PM;5f76d891e31b69006f9b1873;[~accountid:557058:666737e2-1a8a-453f-9a14-72a95f4f92cb] is this done?,11/Nov/24 2:34 PM;557058:666737e2-1a8a-453f-9a14-72a95f4f92cb;[~accountid:5f76d891e31b69006f9b1873] Its done.,,,,,,,,,,,,,,,,,,,,,,,,,,,,,,,,,,,,,,,,,,,,,,,,,,,,,,,,,,,,,,,,,,,,,,,,,,,,,In Progress,08/Nov/24 11:22 AM
"Do not bill: Was working before but now its not: Loss of data during valuation. (spare tyre details, extras)",SR-1306,11615,Recurring bug,Todo,SR,Support,software,Esther,5f76d891e31b69006f9b1873,,Medium,,Mansi Patel,557058:666737e2-1a8a-453f-9a14-72a95f4f92cb,Michael Gachuhi,712020:e146dab8-feed-4174-9a6a-cbe8eff9f9a4,Michael Gachuhi,712020:e146dab8-feed-4174-9a6a-cbe8eff9f9a4,26/Sep/24 11:49 AM,11/Oct/24 5:20 PM,,,,0,,,,,"Do not bill: Was working before but now its not: Loss of data during valuation. (spare tyre details, extras)

Kindly see the URL for one of the vehicles that lost data. [https://login.solvit.limited/admin/valuation/197616|https://login.solvit.limited/admin/valuation/197616]



!image001.png|width=1366,height=768,alt=""image001.png""!

# KCW 345S has a similar issue.  [https://login.solvit.limited/admin/valuation/193137|https://login.solvit.limited/admin/valuation/193137]



!image003.png|width=1366,height=768,alt=""image003.png""!",,Mansi Patel,Michael Gachuhi,,,,,557058:666737e2-1a8a-453f-9a14-72a95f4f92cb,712020:e146dab8-feed-4174-9a6a-cbe8eff9f9a4,,,,,,,,,,,,,,,,,,,,,,,,,,,,,,,,,,,,,,,,,,,,,,,,,,,,,,,,,,,,,,,,,,,,,,,,,,,,,,,,,,,,,,,,,,,,,,,,,,,,,,,,,,,,,,,,,,,,,,,,,,,,,,,,,,,,,,,,,,,,,,,,,,,,,,,,,,,,,,,,,,,,,,,,,,,,,,,,,,,,,,,,,,,,,,,,,,,,,,,,,,,,,,,,,,,,,,,,,,,,,,,,,,,,,,,,,,,,,,26/Sep/24 11:49 AM;rk:9480dc87-535c-4c04-ae8a-4f9a203c908e;image001.png;https://solvit-app.atlassian.net/rest/api/3/attachment/content/11836,26/Sep/24 11:49 AM;rk:9480dc87-535c-4c04-ae8a-4f9a203c908e;image003.png;https://solvit-app.atlassian.net/rest/api/3/attachment/content/11837,,,,,,,,,{},27/Sep/24 12:00 AM,,,0|i0095h:,,,,,,,,,"27/Sep/24 10:10 AM;557058:666737e2-1a8a-453f-9a14-72a95f4f92cb;[~accountid:712020:e146dab8-feed-4174-9a6a-cbe8eff9f9a4] The solver has added blank space in vehicle make and model, that’s why the data was not visible. This does not have any relation with the last build which we have deployed.","01/Oct/24 1:52 PM;712020:e146dab8-feed-4174-9a6a-cbe8eff9f9a4;[~accountid:557058:666737e2-1a8a-453f-9a14-72a95f4f92cb] this is seen on repeated jobs, after the last deployment. 
cc [~accountid:712020:97d62153-cec9-4bd4-bfb6-886c80a4f1f7] 
Kindly Timothy, share several requests that have lost tyre data. ",11/Oct/24 5:20 PM;712020:e146dab8-feed-4174-9a6a-cbe8eff9f9a4;[~accountid:712020:97d62153-cec9-4bd4-bfb6-886c80a4f1f7] kindly refer to the last comment and share more details on the same. ,,,,,,,,,,,,,,,,,,,,,,,,,,,,,,,,,,,,,,,,,,,,,,,,,,,,,,,,,,,,,,,,,,,,,,,,,,,,In Progress,26/Sep/24 11:49 AM
ACTION POINTS FOR SOLVIT :Inclusion of Electric Vehicles into the SOLVIT System,CR-322,11572,Task,Wishlist,CR,Changes,software,Esther,5f76d891e31b69006f9b1873,,Medium,,Mansi Patel,557058:666737e2-1a8a-453f-9a14-72a95f4f92cb,Michael Gachuhi,712020:e146dab8-feed-4174-9a6a-cbe8eff9f9a4,Michael Gachuhi,712020:e146dab8-feed-4174-9a6a-cbe8eff9f9a4,02/Aug/24 6:19 PM,11/Oct/24 3:57 PM,,,13/Sep/24 12:00 AM,0,,,,,"ACTION POINTS FOR SOLVIT

# On selection of Electric as fuel type do the below;
a.	Change title to say Valuation Report for Electric Vehicle…. Use the icon below.
b.	Change Engine Number to Battery Make, Model, and Serial Number like.

ICON TO BE USED
[https://www.pngwing.com/en/free-png-zspac|https://www.pngwing.com/en/free-png-zspac]


[~accountid:557058:666737e2-1a8a-453f-9a14-72a95f4f92cb] please share the number of hours for this. ",,Mansi Patel,Michael Gachuhi,,,,,557058:666737e2-1a8a-453f-9a14-72a95f4f92cb,712020:e146dab8-feed-4174-9a6a-cbe8eff9f9a4,,,,,,,,,,,,,,,,,,,,,,,,,,,,,,,,,,,,,,,,,,,,,,,,,,,,,,,,,,,,,,,,,,,,,,,,,,,,,,,,,,,,,,,,,,,,,,,,,,,,,,,,,,,,,,,,,,,,,,,,,,,,,,,,,,,,,,,,,,,,,,,,,,,,,,,,,,,,,,,,,,,,,,,,,,,,,,,,,,,,,,,,,,,,,,,,,,,,,,,,,,,,,,,,,,,,,,,,,,,,,,,,,,,,,,,,,,,,,,07/Aug/24 12:26 PM;rk:9480dc87-535c-4c04-ae8a-4f9a203c908e;image-20240807-092113.png;https://solvit-app.atlassian.net/rest/api/3/attachment/content/11777,07/Aug/24 12:26 PM;rk:9480dc87-535c-4c04-ae8a-4f9a203c908e;image-20240807-092221.png;https://solvit-app.atlassian.net/rest/api/3/attachment/content/11778,,,,,,,,,{},,,,0|i008x1:,,,,,,,,,05/Aug/24 7:31 AM;712020:e146dab8-feed-4174-9a6a-cbe8eff9f9a4;[~accountid:557058:666737e2-1a8a-453f-9a14-72a95f4f92cb] please respond to this,"05/Aug/24 9:14 AM;557058:666737e2-1a8a-453f-9a14-72a95f4f92cb;[~accountid:712020:e146dab8-feed-4174-9a6a-cbe8eff9f9a4] Based on your description, have not clear idea where to do change changes. on web, report or in mobile. Can you please share the details accordingly along with screen in which we need to make changes?","05/Aug/24 9:30 AM;712020:e146dab8-feed-4174-9a6a-cbe8eff9f9a4;[~accountid:557058:666737e2-1a8a-453f-9a14-72a95f4f92cb] when the job is being done, after a job is initiated, its scheduled to the solver. When the solver *START*  the job, they select several options on first page, including fuel type, 

So we are adding an extra option at fuel type on the mobile app, that is, *Electric*.

When that is selected, the details mentioned above take effect. ",05/Aug/24 10:25 AM;557058:666737e2-1a8a-453f-9a14-72a95f4f92cb;[~accountid:712020:e146dab8-feed-4174-9a6a-cbe8eff9f9a4] Can you please let us know like entertainment unit mean? and where yo use this image?,"07/Aug/24 12:26 PM;712020:e146dab8-feed-4174-9a6a-cbe8eff9f9a4;[~accountid:557058:666737e2-1a8a-453f-9a14-72a95f4f92cb] 
*and where yo use this image?*

Answer:

!image-20240807-092113.png|width=982,height=572,alt=""image-20240807-092113.png""!



!image-20240807-092221.png|width=1046,height=394,alt=""image-20240807-092221.png""!

Add the icon on the parts labeled with red…. let the icon be visible and the *same font size* as the title beside it. 

*Can you please let us know like entertainment unit mean?*

This means: that after you select the fuel type as electric, we have these dropdown fields 
1. Battery Make
2. Battery Serial Number
3. Battery Model

Ignore the entertainment unit part. ",09/Aug/24 8:06 AM;557058:666737e2-1a8a-453f-9a14-72a95f4f92cb;[~accountid:712020:e146dab8-feed-4174-9a6a-cbe8eff9f9a4] We will require 52 hours for the same.,09/Aug/24 8:22 AM;712020:e146dab8-feed-4174-9a6a-cbe8eff9f9a4;[~accountid:557058:666737e2-1a8a-453f-9a14-72a95f4f92cb] can you try kindly to reduce to 40 hours Mansi?,"09/Aug/24 8:30 AM;557058:666737e2-1a8a-453f-9a14-72a95f4f92cb;[~accountid:712020:e146dab8-feed-4174-9a6a-cbe8eff9f9a4] Sorry, we cannot do in 40 hours.",12/Aug/24 8:06 AM;712020:e146dab8-feed-4174-9a6a-cbe8eff9f9a4;[~accountid:557058:666737e2-1a8a-453f-9a14-72a95f4f92cb] how many hours can you minimize to… 45 can do us well.,12/Aug/24 4:41 PM;712020:e146dab8-feed-4174-9a6a-cbe8eff9f9a4;[~accountid:557058:666737e2-1a8a-453f-9a14-72a95f4f92cb] please respond here. Thank you. ,13/Aug/24 8:43 AM;557058:666737e2-1a8a-453f-9a14-72a95f4f92cb;[~accountid:712020:e146dab8-feed-4174-9a6a-cbe8eff9f9a4] At max we can do in 50 hours. Thank you.,14/Aug/24 10:48 AM;712020:e146dab8-feed-4174-9a6a-cbe8eff9f9a4;[~accountid:557058:666737e2-1a8a-453f-9a14-72a95f4f92cb] This is approved. What is the proposed delivery date for this?,14/Aug/24 2:42 PM;557058:666737e2-1a8a-453f-9a14-72a95f4f92cb;[~accountid:712020:e146dab8-feed-4174-9a6a-cbe8eff9f9a4] We can deliver this by 13th September.,14/Aug/24 2:44 PM;712020:e146dab8-feed-4174-9a6a-cbe8eff9f9a4;[~accountid:557058:666737e2-1a8a-453f-9a14-72a95f4f92cb] will keep track of it. ,04/Sep/24 10:21 AM;712020:e146dab8-feed-4174-9a6a-cbe8eff9f9a4;[~accountid:557058:666737e2-1a8a-453f-9a14-72a95f4f92cb] How far  are we with this CR?,04/Sep/24 11:34 AM;557058:666737e2-1a8a-453f-9a14-72a95f4f92cb;[~accountid:712020:e146dab8-feed-4174-9a6a-cbe8eff9f9a4] We already started working on this and will be finishing on 13th September.,11/Sep/24 3:55 PM;557058:666737e2-1a8a-453f-9a14-72a95f4f92cb;[~accountid:712020:e146dab8-feed-4174-9a6a-cbe8eff9f9a4] Do we need to add these changes in accident and assessment as well? or only in valuation?,12/Sep/24 9:00 AM;557058:666737e2-1a8a-453f-9a14-72a95f4f92cb;[~accountid:712020:e146dab8-feed-4174-9a6a-cbe8eff9f9a4] Can you confirm on this?,12/Sep/24 9:21 AM;712020:e146dab8-feed-4174-9a6a-cbe8eff9f9a4;[~accountid:557058:666737e2-1a8a-453f-9a14-72a95f4f92cb] yes 100% we need to add in accident and assessment as well. ,"11/Oct/24 8:29 AM;557058:666737e2-1a8a-453f-9a14-72a95f4f92cb;[~accountid:712020:e146dab8-feed-4174-9a6a-cbe8eff9f9a4] This is also completed, please verify on staging.",11/Oct/24 3:57 PM;712020:e146dab8-feed-4174-9a6a-cbe8eff9f9a4;[~accountid:557058:666737e2-1a8a-453f-9a14-72a95f4f92cb] checking. ,,,,,,,,,,,,,,,,,,,,,,,,,,,,,,,,,,,,,,,,,,,,,,,,,,,,,,,,,,To Do,02/Oct/24 5:20 PM
"Do not bill: The 2nd Solver does not receive a message when a client clicks on a link, if the first solver do not accept the request. ",SR-1293,11602,Task,Todo,SR,Support,software,Esther,5f76d891e31b69006f9b1873,,Medium,,Mansi Patel,557058:666737e2-1a8a-453f-9a14-72a95f4f92cb,Michael Gachuhi,712020:e146dab8-feed-4174-9a6a-cbe8eff9f9a4,Michael Gachuhi,712020:e146dab8-feed-4174-9a6a-cbe8eff9f9a4,16/Sep/24 10:19 AM,07/Oct/24 1:35 PM,,,16/Sep/24 12:00 AM,0,,,,,"When a client clicks a link, the solver need to receive an SMS and a notification.The message goes to the first solver only. This means if the solver does not accept that request, it is sent to another solver. 



The second solver gets only a notification on the app but does not receive an SMS. If the solver clicks the notification and gets in the app. he does not see the request.

This came after deployment that we did last [week.|http://week.Do]

[Do|http://week.Do] not bill.",,Mansi Patel,Michael Gachuhi,,,,,557058:666737e2-1a8a-453f-9a14-72a95f4f92cb,712020:e146dab8-feed-4174-9a6a-cbe8eff9f9a4,,,,,,,,,,,,,,,,,,,,,,,,,,,,,,,,,,,,,,,,,,,,,,,,,,,,,,,,,,,,,,,,,,,,,,,,,,,,,,,,,,,,,,,,,,,,,,,,,,,,,,,,,,,,,,,,,,,,,,,,,,,,,,,,,,,,,,,,,,,,,,,,,,,,,,,,,,,,,,,,,,,,,,,,,,,,,,,,,,,,,,,,,,,,,,,,,,,,,,,,,,,,,,,,,,,,,,,,,,,,,,,,,,,,,,,,,,,,,,17/Sep/24 7:22 AM;rk:9480dc87-535c-4c04-ae8a-4f9a203c908e;WhatsApp Image 2024-09-17 at 07.19.00_5b14da0e-20240917-041928.jpg;https://solvit-app.atlassian.net/rest/api/3/attachment/content/11820,,,,,,,,,,{},,,,0|i0092l:,,,,,,,,,16/Sep/24 11:39 AM;557058:666737e2-1a8a-453f-9a14-72a95f4f92cb;[~accountid:712020:e146dab8-feed-4174-9a6a-cbe8eff9f9a4] When a client clicks a link mean? which page are you referring to?,"17/Sep/24 7:22 AM;712020:e146dab8-feed-4174-9a6a-cbe8eff9f9a4;{color:#ff5630}*When a client clicks a link mean?*{color}

This link in the message….



!WhatsApp Image 2024-09-17 at 07.19.00_5b14da0e-20240917-041928.jpg|width=640,height=390,alt=""WhatsApp Image 2024-09-17 at 07.19.00_5b14da0e-20240917-041928.jpg""!



{color:#ff5630}*which page are you referring to?*{color}

REFER to this SR
[https://solvit-app.atlassian.net/browse/SR-918|https://solvit-app.atlassian.net/browse/SR-918|smart-link] 

The vehicle details in first page of a valuation on solver’s app always repopulate on a repeat job. 

That is what I meant. ","18/Sep/24 10:17 AM;557058:666737e2-1a8a-453f-9a14-72a95f4f92cb;[~accountid:712020:e146dab8-feed-4174-9a6a-cbe8eff9f9a4] Thank you for sharing the information, can you please share the request id, we would like to check further.",01/Oct/24 1:57 PM;712020:e146dab8-feed-4174-9a6a-cbe8eff9f9a4;[~accountid:557058:666737e2-1a8a-453f-9a14-72a95f4f92cb] kindly try to reproduce this from your end as I cannot be able to test as two solvers. ,07/Oct/24 1:35 PM;557058:666737e2-1a8a-453f-9a14-72a95f4f92cb;[~accountid:712020:e146dab8-feed-4174-9a6a-cbe8eff9f9a4] Can you confirm which SMS a solver should receive? Can you please share that sms and notification as well so it will help to rectify.,,,,,,,,,,,,,,,,,,,,,,,,,,,,,,,,,,,,,,,,,,,,,,,,,,,,,,,,,,,,,,,,,,,,,,,,,,In Progress,16/Sep/24 10:19 AM
Paused jobs limit,CR-283,10946,Task,Wishlist,CR,Changes,software,Esther,5f76d891e31b69006f9b1873,,Medium,,,,Esther,5f76d891e31b69006f9b1873,Esther,5f76d891e31b69006f9b1873,13/Mar/23 10:03 AM,02/Oct/24 9:23 PM,,,,0,,,,,Paused Jobs limit: We limit the number of paused jobs a Solver can have to 10. Once this limit is reached they can no longer receive any new jobs and are advised to complete the jobs on their scheduled list. ,,Esther,,,,,,5f76d891e31b69006f9b1873,,,,,,,,,,,,,,,,,,,,,,,,,,,,,,,,,,,,,,,,,,,,,,,,,,,,,,,,,,,,,,,,,,,,,,,,,,,,,,,,,,,,,,,,,,,,,,,,,,,,,,,,,,,,,,,,,,,,,,,,,,,,,,,,,,,,,,,,,,,,,,,,,,,,,,,,,,,,,,,,,,,,,,,,,,,,,,,,,,,,,,,,,,,,,,,,,,,,,,,,,,,,,,,,,,,,,,,,,,,,,,,,,,,,,,,,,,,,,,,,,,,,,,,,,{},,,,0|i00539:,,,,,,,,,,,,,,,,,,,,,,,,,,,,,,,,,,,,,,,,,,,,,,,,,,,,,,,,,,,,,,,,,,,,,,,,,,,,,,,,,,,,,,,To Do,13/Mar/23 10:03 AM
